{
  "$schema": "../../../info.schema.json",
  "id": "Italia",
  "name": "Italia",
  "translation_key": "map.italia",
  "categories": ["europe"],
  "location": { "lat": 42.8, "lon": 12.6 },
  "author": "evanpelle",
  "nations": [
    {
      "coordinates": [1038, 993],
      "name": "Kingdom of the Two Sicilies",
      "flag": "TwoSicilies"
    },
    {
      "coordinates": [370, 1137],
      "name": "Beylik of Tunis",
      "flag": "tn"
    },
    {
      "coordinates": [785, 578],
      "name": "Papal States",
      "flag": "PapalStates"
    },
    {
      "coordinates": [625, 534],
      "name": "Grand Duchy of Tuscany",
      "flag": "Grand Duchy of Tuscany"
    },
    {
      "coordinates": [595, 190],
      "name": "Republic of Venice",
      "flag": "venice"
    },
    {
      "coordinates": [469, 386],
      "name": "Duchy of Modena",
      "flag": "Duchy of Modena and Reggio"
    },
    {
      "coordinates": [391, 254],
      "name": "Duchy of Parma",
      "flag": "Duchy of Parma"
    },
    {
      "coordinates": [361, 68],
      "name": "Switzerland",
      "flag": "ch"
    },
    {
      "coordinates": [278, 774],
      "name": "Kingdom of Sardinia",
      "flag": "Kingdom of Sardinia"
    },
    {
      "coordinates": [29, 266],
      "name": "France",
      "flag": "fr"
    },
    {
      "coordinates": [747, 39],
      "name": "Austrian Empire",
      "flag": "Habsburg Austria"
    },
    {
      "coordinates": [870, 1240],
      "name": "Colony of Malta",
      "flag": "gb"
    },
    {
      "coordinates": [1255, 31],
      "name": "Kingdom of Hungary",
      "flag": "Kingdom of Hungary"
    },
    {
      "coordinates": [630, 350],
      "name": "San Marino",
      "flag": "sm"
    },
    {
      "coordinates": [1238, 349],
      "name": "Ottoman Empire",
      "flag": "tr"
    }
  ],
  "themes": ["europe"]
}
