{
  "$schema": "../../../info.schema.json",
  "id": "Tutorial",
  "name": "Tutorial",
  "translation_key": "map.tutorial",
  "categories": ["fictional"],
  "author": "evanpelle",
  "hidden": true,
  "custom_tribes": [{ "name": "Hill Tribe", "coordinates": [38, 49] }],
  "nations": [
    {
      "coordinates": [175, 84],
      "flag": "",
      "name": "Red Empire"
    }
  ]
}
