{
  "$schema": "../../../info.schema.json",
  "id": "Mars",
  "name": "Mars",
  "translation_key": "map.mars",
  "categories": ["cosmic"],
  "author": "NewHappyRabbit",
  "nations": [
    {
      "coordinates": [650, 415],
      "name": "United States",
      "flag": "us"
    },
    {
      "coordinates": [122, 750],
      "name": "USSR",
      "flag": "ussr"
    },
    {
      "coordinates": [1232, 735],
      "name": "Russia",
      "flag": "ru"
    },
    {
      "coordinates": [966, 511],
      "name": "European Space Agency",
      "flag": ""
    },
    {
      "coordinates": [1460, 488],
      "name": "United Kingdom",
      "flag": "gb"
    },
    {
      "coordinates": [1850, 415],
      "name": "China",
      "flag": "cn"
    }
  ]
}
