{
  "$schema": "../../../info.schema.json",
  "id": "LasVegasStrip",
  "name": "Las Vegas Strip",
  "translation_key": "map.lasvegasstrip",
  "categories": ["north_america"],
  "location": { "lat": 36.1, "lon": -115.2 },
  "author": "crunchybbb",
  "nations": [
    {
      "coordinates": [954, 2653],
      "name": "Sphere",
      "flag": "Nevada"
    },
    {
      "coordinates": [1105, 691],
      "name": "Las Vegas Premium Outlets",
      "flag": "Nevada"
    },
    {
      "coordinates": [1153, 455],
      "name": "World Market Center",
      "flag": "us"
    },
    {
      "coordinates": [1635, 414],
      "name": "Fremont Street",
      "flag": "Nevada"
    },
    {
      "coordinates": [1777, 357],
      "name": "Las Vegas Downtown",
      "flag": "Nevada"
    },
    {
      "coordinates": [1378, 904],
      "name": "Arts District",
      "flag": "Nevada"
    },
    {
      "coordinates": [1177, 1429],
      "name": "The STRAT",
      "flag": "Nevada"
    },
    {
      "coordinates": [1086, 1247],
      "name": "Gateway District",
      "flag": "Nevada"
    },
    {
      "coordinates": [1147, 1672],
      "name": "Sahara",
      "flag": "eg"
    },
    {
      "coordinates": [795, 1909],
      "name": "Circus Circus",
      "flag": "us"
    },
    {
      "coordinates": [751, 2080],
      "name": "Resorts World",
      "flag": "my"
    },
    {
      "coordinates": [1088, 1909],
      "name": "Fontainebleau",
      "flag": "Nevada"
    },
    {
      "coordinates": [566, 2268],
      "name": "Trump Hotel",
      "flag": "us"
    },
    {
      "coordinates": [613, 2384],
      "name": "Fashion Show Mall",
      "flag": "Nevada"
    },
    {
      "coordinates": [841, 2387],
      "name": "Wynn",
      "flag": "us"
    },
    {
      "coordinates": [727, 2579],
      "name": "Venetian",
      "flag": "venice"
    },
    {
      "coordinates": [574, 2494],
      "name": "Treasure Island",
      "flag": "Republic of Pirates"
    },
    {
      "coordinates": [446, 2861],
      "name": "Caesars Palace",
      "flag": "SPQR"
    },
    {
      "coordinates": [636, 2731],
      "name": "Harrah's",
      "flag": "Nevada"
    },
    {
      "coordinates": [633, 2910],
      "name": "Flamingo",
      "flag": "Nevada"
    },
    {
      "coordinates": [437, 3039],
      "name": "Bellagio",
      "flag": "it"
    },
    {
      "coordinates": [667, 3044],
      "name": "Paris",
      "flag": "fr"
    },
    {
      "coordinates": [655, 3172],
      "name": "Planet Hollywood",
      "flag": "California"
    },
    {
      "coordinates": [440, 3168],
      "name": "Cosmopolitan",
      "flag": "Nevada"
    },
    {
      "coordinates": [373, 3290],
      "name": "ARIA",
      "flag": "Nevada"
    },
    {
      "coordinates": [671, 3497],
      "name": "MGM Grand",
      "flag": "Nevada"
    },
    {
      "coordinates": [482, 3531],
      "name": "New York New York",
      "flag": "New_York"
    },
    {
      "coordinates": [513, 3395],
      "name": "Park MGM",
      "flag": "Nevada"
    },
    {
      "coordinates": [458, 3691],
      "name": "Excalibur",
      "flag": "1_Essex"
    },
    {
      "coordinates": [430, 3847],
      "name": "Luxor",
      "flag": "Kingdom of Egypt"
    },
    {
      "coordinates": [538, 4397],
      "name": "Fabulous Las Vegas Sign",
      "flag": "Nevada"
    },
    {
      "coordinates": [393, 4083],
      "name": "Mandalay Bay",
      "flag": "mm"
    },
    {
      "coordinates": [147, 4048],
      "name": "Allegiant Stadium",
      "flag": "Nevada"
    },
    {
      "coordinates": [447, 2641],
      "name": "Hard Rock Casino",
      "flag": "Nevada"
    }
  ],
  "additionalNations": [
    {
      "coordinates": [720, 2987],
      "name": "Horseshoe",
      "flag": "Nevada"
    },
    {
      "name": "Tropicana",
      "flag": "Nevada"
    },
    {
      "coordinates": [504, 4014],
      "name": "Four Seasons Hotel",
      "flag": "Nevada"
    },
    {
      "coordinates": [624, 2806],
      "name": "The LINQ",
      "flag": "Nevada"
    },
    {
      "coordinates": [427, 2760],
      "name": "The Forum Shops",
      "flag": "SPQR"
    },
    {
      "coordinates": [1119, 2407],
      "name": "Wynn Golf Club",
      "flag": "us"
    },
    {
      "coordinates": [1086, 2054],
      "name": "Convention Center",
      "flag": "Nevada"
    },
    {
      "coordinates": [823, 2260],
      "name": "Encore",
      "flag": "Nevada"
    },
    {
      "coordinates": [320, 3209],
      "name": "Vdara",
      "flag": "Nevada"
    },
    {
      "coordinates": [348, 3498],
      "name": "T-Mobile Arena",
      "flag": "Nevada"
    },
    {
      "coordinates": [1811, 449],
      "name": "El Cortez Casino",
      "flag": "Nevada"
    },
    {
      "coordinates": [1669, 367],
      "name": "Binion's Casino",
      "flag": "Nevada"
    },
    {
      "coordinates": [1665, 445],
      "name": "Four Queens Casino",
      "flag": "Nevada"
    },
    {
      "coordinates": [1491, 356],
      "name": "Plaza Casino",
      "flag": "Nevada"
    },
    {
      "coordinates": [1566, 334],
      "name": "Circa Casino",
      "flag": "Nevada"
    },
    {
      "coordinates": [1578, 405],
      "name": "Golden Nugget Casino",
      "flag": "California"
    },
    {
      "coordinates": [750, 1996],
      "name": "Hilton",
      "flag": "us"
    },
    {
      "coordinates": [848, 2050],
      "name": "Conrad",
      "flag": "Nevada"
    },
    {
      "coordinates": [730, 1864],
      "name": "The Adventuredome",
      "flag": "Nevada"
    },
    {
      "coordinates": [568, 3483],
      "name": "M&M's World",
      "flag": "Nevada"
    },
    {
      "coordinates": [531, 3530],
      "name": "Hershey's World",
      "flag": "Nevada"
    },
    {
      "coordinates": [738, 3619],
      "name": "OYO",
      "flag": "Nevada"
    },
    {
      "name": "The Dunes",
      "flag": "Nevada"
    },
    {
      "name": "The Sands",
      "flag": "Nevada"
    },
    {
      "name": "Desert Inn",
      "flag": "Nevada"
    },
    {
      "name": "The New Frontier",
      "flag": "Nevada"
    },
    {
      "name": "El Rancho",
      "flag": "Nevada"
    },
    {
      "name": "Riviera",
      "flag": "Nevada"
    },
    {
      "name": "The Landmark",
      "flag": "Nevada"
    },
    {
      "name": "The Hacienda",
      "flag": "Nevada"
    },
    {
      "name": "The Castaways",
      "flag": "Nevada"
    },
    {
      "name": "Aladdin Hotel",
      "flag": "sa"
    },
    {
      "coordinates": [593, 3391],
      "name": "Polo Towers",
      "flag": "Nevada"
    }
  ],
  "themes": ["north_america", "western"]
}
