{
  "$schema": "../../../info.schema.json",
  "id": "EuropeClassic",
  "name": "Europe Classic",
  "display_name": "Europe (Classic)",
  "translation_key": "map.europeclassic",
  "categories": ["europe", "continental"],
  "location": { "lat": 48, "lon": 22 },
  "author": "evanpelle",
  "nations": [
    {
      "coordinates": [171, 171],
      "name": "Iceland",
      "flag": "is"
    },
    {
      "coordinates": [477, 473],
      "name": "Ireland",
      "flag": "ie"
    },
    {
      "coordinates": [650, 477],
      "name": "United Kingdom",
      "flag": "gb"
    },
    {
      "coordinates": [612, 809],
      "name": "Spain",
      "flag": "es"
    },
    {
      "coordinates": [729, 648],
      "name": "France",
      "flag": "fr"
    },
    {
      "coordinates": [1050, 745],
      "name": "Italy",
      "flag": "it"
    },
    {
      "coordinates": [895, 641],
      "name": "Switzerland",
      "flag": "ch"
    },
    {
      "coordinates": [935, 259],
      "name": "Norway",
      "flag": "no"
    },
    {
      "coordinates": [1105, 286],
      "name": "Sweden",
      "flag": "se"
    },
    {
      "coordinates": [1438, 209],
      "name": "Finland",
      "flag": "fi"
    },
    {
      "coordinates": [819, 534],
      "name": "Belgium",
      "flag": "be"
    },
    {
      "coordinates": [868, 485],
      "name": "Netherlands",
      "flag": "nl"
    },
    {
      "coordinates": [1000, 480],
      "name": "Germany",
      "flag": "de"
    },
    {
      "coordinates": [1017, 628],
      "name": "Austria",
      "flag": "at"
    },
    {
      "coordinates": [1220, 491],
      "name": "Poland",
      "flag": "pl"
    },
    {
      "coordinates": [1078, 564],
      "name": "Czechia",
      "flag": "cz"
    },
    {
      "coordinates": [1540, 602],
      "name": "Ukraine",
      "flag": "ua"
    },
    {
      "coordinates": [1517, 424],
      "name": "Belarus",
      "flag": "by"
    },
    {
      "coordinates": [1414, 667],
      "name": "Romania",
      "flag": "ro"
    },
    {
      "coordinates": [1614, 834],
      "name": "Türkiye",
      "flag": "tr"
    },
    {
      "coordinates": [525, 955],
      "name": "Morocco",
      "flag": "ma"
    },
    {
      "coordinates": [1771, 413],
      "name": "Russia",
      "flag": "ru"
    },
    {
      "coordinates": [1750, 950],
      "name": "Syria",
      "flag": "sy"
    },
    {
      "coordinates": [1930, 950],
      "name": "Iraq",
      "flag": "iq"
    },
    {
      "coordinates": [1900, 720],
      "name": "Georgia",
      "flag": "ge"
    },
    {
      "coordinates": [950, 930],
      "name": "Tunisia",
      "flag": "tn"
    },
    {
      "coordinates": [740, 940],
      "name": "Algeria",
      "flag": "dz"
    },
    {
      "coordinates": [460, 830],
      "name": "Portugal",
      "flag": "pt"
    },
    {
      "coordinates": [1300, 830],
      "name": "Greece",
      "flag": "gr"
    },
    {
      "coordinates": [1270, 700],
      "name": "Serbia",
      "flag": "rs"
    },
    {
      "coordinates": [1218, 602],
      "name": "Hungary",
      "flag": "hu"
    },
    {
      "coordinates": [1277, 90],
      "name": "Sápmi",
      "flag": "Sami flag"
    },
    {
      "coordinates": [1406, 324],
      "name": "Estonia",
      "flag": "ee"
    },
    {
      "coordinates": [1380, 384],
      "name": "Latvia",
      "flag": "lv"
    },
    {
      "coordinates": [1355, 444],
      "name": "Lithuania",
      "flag": "lt"
    },
    {
      "coordinates": [1121, 668],
      "name": "Croatia",
      "flag": "hr"
    },
    {
      "coordinates": [959, 394],
      "name": "Denmark",
      "flag": "dk"
    }
  ],
  "themes": ["europe"]
}
