{
  "$schema": "../../../info.schema.json",
  "id": "Pangaea",
  "name": "Pangaea",
  "translation_key": "map.pangaea",
  "categories": ["fictional"],
  "author": "MRH",
  "nations": [
    {
      "coordinates": [389, 800],
      "name": "South Africa",
      "flag": "za"
    },
    {
      "coordinates": [500, 780],
      "name": "Madagascar",
      "flag": "mg"
    },
    {
      "coordinates": [515, 600],
      "name": "Egypt",
      "flag": "eg"
    },
    {
      "coordinates": [180, 420],
      "name": "United States",
      "flag": "us"
    },
    {
      "coordinates": [200, 310],
      "name": "Canada",
      "flag": "ca"
    },
    {
      "coordinates": [150, 460],
      "name": "Mexico",
      "flag": "mx"
    },
    {
      "coordinates": [160, 600],
      "name": "Colombia",
      "flag": "co"
    },
    {
      "coordinates": [280, 800],
      "name": "Argentina",
      "flag": "ar"
    },
    {
      "coordinates": [250, 600],
      "name": "Brazil",
      "flag": "br"
    },
    {
      "coordinates": [470, 890],
      "name": "Antarctica",
      "flag": "aq"
    },
    {
      "coordinates": [400, 340],
      "name": "Greenland",
      "flag": "gl"
    },
    {
      "coordinates": [550, 440],
      "name": "Spain",
      "flag": "es"
    },
    {
      "coordinates": [550, 450],
      "name": "France",
      "flag": "fr"
    },
    {
      "coordinates": [510, 380],
      "name": "Germany",
      "flag": "de"
    },
    {
      "coordinates": [480, 365],
      "name": "Sweden",
      "flag": "se"
    },
    {
      "coordinates": [605, 370],
      "name": "Turkey",
      "flag": "tr"
    },
    {
      "coordinates": [480, 335],
      "name": "Finland",
      "flag": "fi"
    },
    {
      "coordinates": [570, 340],
      "name": "Ukraine",
      "flag": "ua"
    },
    {
      "coordinates": [570, 290],
      "name": "Russia",
      "flag": "ru"
    },
    {
      "coordinates": [490, 150],
      "name": "Mongolia",
      "flag": "mn"
    },
    {
      "coordinates": [550, 70],
      "name": "China",
      "flag": "cn"
    },
    {
      "coordinates": [620, 650],
      "name": "India",
      "flag": "in"
    },
    {
      "coordinates": [545, 200],
      "name": "Kazakhstan",
      "flag": "kz"
    },
    {
      "coordinates": [600, 600],
      "name": "Saudi Arabia",
      "flag": "sa"
    },
    {
      "coordinates": [680, 830],
      "name": "Australia",
      "flag": "au"
    },
    {
      "coordinates": [540, 650],
      "name": "Ethiopia",
      "flag": "et"
    },
    {
      "coordinates": [400, 500],
      "name": "Chad",
      "flag": "td"
    },
    {
      "coordinates": [420, 25],
      "name": "Japan",
      "flag": "jp"
    },
    {
      "coordinates": [480, 410],
      "name": "United Kingdom",
      "flag": "gb"
    }
  ]
}
