{
  "$schema": "../../../info.schema.json",
  "id": "BosphorusStraits",
  "name": "Bosphorus Straits",
  "translation_key": "map.bosphorusstraits",
  "categories": ["europe", "asia"],
  "location": { "lat": 41.1, "lon": 29 },
  "author": "TsProphet94",
  "special_team_count": 2,
  "nations": [
    {
      "coordinates": [564, 245],
      "name": "Beykoz",
      "flag": "tr"
    },
    {
      "coordinates": [820, 209],
      "name": "Sile",
      "flag": "tr"
    },
    {
      "coordinates": [700, 316],
      "name": "Çekmeköy",
      "flag": "tr"
    },
    {
      "coordinates": [800, 438],
      "name": "Pendik",
      "flag": "tr"
    },
    {
      "coordinates": [797, 566],
      "name": "Tuzla",
      "flag": "tr"
    },
    {
      "coordinates": [486, 381],
      "name": "Üsküdar",
      "flag": "tr"
    },
    {
      "coordinates": [534, 425],
      "name": "Kadiköy",
      "flag": "tr"
    },
    {
      "coordinates": [559, 568],
      "name": "Adalar",
      "flag": "tr"
    },
    {
      "coordinates": [635, 500],
      "name": "Maltepe",
      "flag": "tr"
    },
    {
      "coordinates": [701, 423],
      "name": "Sancaktepe",
      "flag": "tr"
    },
    {
      "coordinates": [424, 394],
      "name": "Fatih",
      "flag": "tr"
    },
    {
      "coordinates": [128, 46],
      "name": "Arnavutköy",
      "flag": "tr"
    },
    {
      "coordinates": [965, 544],
      "name": "Kocaeli",
      "flag": "tr"
    },
    {
      "coordinates": [42, 325],
      "name": "Büyükçekmece",
      "flag": "tr"
    },
    {
      "coordinates": [336, 175],
      "name": "Eyüpsultan",
      "flag": "tr"
    },
    {
      "coordinates": [459, 157],
      "name": "Sariyer",
      "flag": "tr"
    },
    {
      "coordinates": [477, 297],
      "name": "Besiktas",
      "flag": "tr"
    },
    {
      "coordinates": [171, 379],
      "name": "Avcilar",
      "flag": "tr"
    },
    {
      "coordinates": [308, 412],
      "name": "Bakirköy",
      "flag": "tr"
    },
    {
      "coordinates": [263, 283],
      "name": "Basaksehir",
      "flag": "tr"
    },
    {
      "coordinates": [402, 272],
      "name": "Sultangazi",
      "flag": "tr"
    },
    {
      "coordinates": [130, 270],
      "name": "Esenyurt",
      "flag": "tr"
    }
  ],
  "teamGameSpawnAreas": {
    "2": [
      {
        "height": 612,
        "width": 500,
        "x": 0,
        "y": 0
      },
      {
        "height": 612,
        "width": 500,
        "x": 500,
        "y": 0
      }
    ]
  },
  "themes": ["europe", "asia"]
}
