{
  "$schema": "../../../info.schema.json",
  "id": "Iceland",
  "name": "Iceland",
  "translation_key": "map.iceland",
  "categories": ["europe"],
  "location": { "lat": 64.9, "lon": -18.6 },
  "author": "Duwibi",
  "nations": [
    {
      "coordinates": [455, 1115],
      "name": "Southern Peninsula",
      "flag": "is"
    },
    {
      "coordinates": [550, 1050],
      "name": "Capital Region",
      "flag": "is"
    },
    {
      "coordinates": [370, 810],
      "name": "Western Region",
      "flag": "is"
    },
    {
      "coordinates": [290, 560],
      "name": "Westfjords",
      "flag": "is"
    },
    {
      "coordinates": [790, 555],
      "name": "Northwestern Region",
      "flag": "is"
    },
    {
      "coordinates": [1050, 1235],
      "name": "Southern Region",
      "flag": "is"
    },
    {
      "coordinates": [1240, 660],
      "name": "Northeastern Region",
      "flag": "is"
    },
    {
      "coordinates": [1740, 740],
      "name": "Eastern Region",
      "flag": "is"
    }
  ],
  "themes": ["europe"]
}
