{
  "$schema": "../../../info.schema.json",
  "id": "Surrounded",
  "name": "Surrounded",
  "translation_key": "map.surrounded",
  "categories": ["fictional"],
  "author": "FloPinguin",
  "description": "A ring of islands around a central one, so every expansion needs a boat. One hydrogen bomb can wipe out a whole island. Can you win a public FFA after spawning in the middle?",
  "special_team_count": 4,
  "nations": [
    {
      "coordinates": [1043, 910],
      "flag": "",
      "name": "Endangered Islander"
    },
    {
      "coordinates": [684, 271],
      "flag": "",
      "name": "North Islander"
    },
    {
      "coordinates": [1429, 429],
      "flag": "",
      "name": "Isolated Islander"
    },
    {
      "coordinates": [1726, 1022],
      "flag": "",
      "name": "Volcano Islander"
    },
    {
      "coordinates": [1422, 1569],
      "flag": "",
      "name": "Resilient Islander"
    },
    {
      "coordinates": [670, 1742],
      "flag": "",
      "name": "Vulnerable Islander"
    },
    {
      "coordinates": [282, 1160],
      "flag": "",
      "name": "Unyielding Islander"
    },
    {
      "coordinates": [384, 469],
      "flag": "",
      "name": "Rugged Islander"
    }
  ],
  "teamGameSpawnAreas": {
    "2": [
      {
        "height": 1976,
        "width": 988,
        "x": 0,
        "y": 0
      },
      {
        "height": 1976,
        "width": 988,
        "x": 988,
        "y": 0
      }
    ],
    "4": [
      {
        "height": 988,
        "width": 988,
        "x": 0,
        "y": 0
      },
      {
        "height": 988,
        "width": 988,
        "x": 988,
        "y": 0
      },
      {
        "height": 988,
        "width": 988,
        "x": 0,
        "y": 988
      },
      {
        "height": 988,
        "width": 988,
        "x": 988,
        "y": 988
      }
    ]
  }
}
